{
  "schema_version": 1,
  "schema_ref": "../../../../templates/schemas/mobile-context.schema.json",
  "run_id": "example-standard-new-view",
  "workflow": "new-view",
  "spec_level": "standard",
  "workflow_controller": "ds-orchestrator",
  "packet_owner_target_id": "app",
  "packet_root": "/workspace/app/.sopp/flow_result/specs/new-view-product-detail",
  "status": "pending_human_review",
  "current_phase": "spec_review",
  "checkpoints": {
    "initial_spec": {
      "required": true,
      "phase": "spec_review",
      "status": "pending",
      "decision_ref": "review.md"
    },
    "ds_layer": {
      "required": true,
      "phase": "ds_layer",
      "status": "pending",
      "decision_ref": "evidence/ds-layer-checkpoint.md"
    },
    "app_view_layer": {
      "required": true,
      "phase": "app_view_layer",
      "status": "pending",
      "decision_ref": "evidence/app-view-layer-checkpoint.md"
    }
  },
  "pending_human_review": {
    "kind": "initial_spec_approval",
    "review_ref": "review.md"
  },
  "completed_phases": [],
  "phase_results": {},
  "artifacts": {}
}
