{
  "schema_version": 1,
  "schema_ref": "../../../../templates/schemas/mobile-context.schema.json",
  "run_id": "example-mini-new-component",
  "workflow": "new-component",
  "spec_level": "mini",
  "workflow_controller": "ds-orchestrator",
  "packet_owner_target_id": "design_system",
  "packet_root": "/workspace/design-system/.sopp/flow_result/specs/new-component",
  "status": "pending_human_review",
  "current_phase": "spec_review",
  "checkpoints": {
    "initial_spec": {
      "required": true,
      "phase": "spec_review",
      "status": "pending",
      "decision_ref": "review.md"
    }
  },
  "completed_phases": [],
  "phase_results": {},
  "pending_human_review": {
    "kind": "initial_spec_approval",
    "review_ref": "review.md"
  },
  "artifacts": {}
}
